{
  "schemaVersion": 1,
  "eventID": "55555555-5555-4555-8555-555555555555",
  "sessionID": "22222222-2222-4222-8222-222222222222",
  "projectID": "11111111-1111-4111-8111-111111111111",
  "origin": "exampleOnly",
  "kind": "context.returned",
  "observedAt": "2026-09-07T00:00:00Z",
  "payload": {
    "exampleOnly": true,
    "pageIDs": [
      "33333333-3333-4333-8333-333333333333"
    ],
    "deliveryState": "returned",
    "notProofOfModelUse": true
  }
}
